{
	"title": "LiskProtocolSpec",
	"description": "Schema specification for JSON specs output",
	"$id": "https://lisk.io/schemas/protocol_specs",
	"$schema": "http://json-schema.org/draft-07/schema#",
	"type": "object",
	"additionalProperties": false,
	"required": ["title", "summary", "runner", "handler", "testCases"],
	"properties": {
		"title": {
			"type": "string",
			"description": "A string type value giving a short title of the spec",
			"minLength": 10,
			"maxLength": 100
		},
		"summary": {
			"type": "string",
			"description": "A string type value explaining in detail purpose and value of the spec",
			"minLength": 25,
			"maxLength": 300
		},
		"runner": {
			"type": "string",
			"description": "A string identifier to point to a protocol spec name e.g. dpos, bft",
			"minLength": 3,
			"maxLength": 100,
			"pattern": "[a-z0-9_]*"
		},
		"handler": {
			"type": "string",
			"description": "A string value to differentiate between same identifier for protocol spec",
			"minLength": 3,
			"maxLength": 100,
			"pattern": "[a-z0-9_]*"
		},
		"config": {
			"$ref": "#/definitions/Config"
		},
		"testCases": {
			"type": "array",
			"description": "List down all test cases for current handler and runner",
			"items": {
				"$ref": "#/definitions/TestCase"
			}
		}
	},
	"definitions": {
		"Account": {
			"title": "Account",
			"description": "Schema to specify and validate account in JSON specs",
			"type": "object"
		},
		"Block": {
			"title": "Block",
			"description": "Schema to specify and validate blocks in JSON specs",
			"type": "object"
		},
		"State": {
			"title": "State",
			"description": "A JSON object represents basic chain state for individual spec to be executed.",
			"type": "object",
			"properties": {
				"chain": {
					"type": "array",
					"uniqueItems": true,
					"items": {
						"$ref": "#/definitions/Block"
					}
				},
				"accounts": {
					"type": "array",
					"uniqueItems": true,
					"items": {
						"$ref": "#/definitions/Account"
					}
				}
			}
		},
		"Config": {
			"title": "Config",
			"description": "A JSON object containing all necessary configurations for the environment in which these specs were generated and individual test case can be verified.",
			"type": "object",
			"additionalProperties": true,
			"required": [],
			"properties": {
				"initialState": {
					"$ref": "#/definitions/State"
				}
			}
		},
		"TestCase": {
			"title": "Schema for a single test case",
			"type": "object",
			"additionalProperties": false,
			"required": ["input", "output", "description"],
			"properties": {
				"description": {
					"type": "string",
					"minLength": 10,
					"maxLength": 300
				},
				"config": {
					"description": "Configuration for a single test case",
					"$ref": "#/definitions/Config"
				},
				"input": {
					"type": "object",
					"description": "Input must be specified as a single object. If its complex scenario, it should be divided to multiple to have simple input/output expectations.",
					"minProperties": 1
				},
				"output": {
					"type": "object",
					"description": "Output must be specified as a single object. If its complex scenario, it should be divided to multiple to have simple input/output expectations.",
					"required": [],
					"additionalProperties": true,
					"minProperties": 1,
					"properties": {
						"mutatedState": {
							"description": "Modified chain state",
							"$ref": "#/definitions/State"
						}
					}
				}
			}
		}
	}
}
