{
	"title": "Valid string encodings",
	"summary": "Examples of encoding strings as required by lisk-codec",
	"config": {
		"network": "devnet"
	},
	"runner": "lisk_codec",
	"handler": "validStringEncodings",
	"testCases": [
		{
			"description": "Encoding of string types",
			"config": {
				"network": "devnet"
			},
			"input": {
				"string": {
					"object": {
						"data": "Checkout Lisk SDK!"
					},
					"schema": {
						"$id": "object7",
						"type": "object",
						"properties": {
							"data": {
								"dataType": "string",
								"fieldNumber": 1
							}
						}
					}
				},
				"emptyString": {
					"object": {
						"data": ""
					},
					"schema": {
						"$id": "object8",
						"type": "object",
						"properties": {
							"data": {
								"dataType": "string",
								"fieldNumber": 1
							}
						}
					}
				}
			},
			"output": {
				"string": "0a12436865636b6f7574204c69736b2053444b21",
				"emptyString": "0a00"
			}
		}
	]
}
