{
	"title": "Valid array encodings",
	"summary": "Examples of encoding arrays as required by lisk-codec",
	"config": {
		"network": "devnet"
	},
	"runner": "lisk_codec",
	"handler": "validArrayEncodings",
	"testCases": [
		{
			"description": "Encoding of boolean types",
			"config": {
				"network": "devnet"
			},
			"input": {
				"arrayInts": {
					"object": {
						"list": [
							3,
							1,
							4,
							1,
							5,
							9,
							2,
							6,
							5
						]
					},
					"schema": {
						"type": "object",
						"properties": {
							"list": {
								"dataType": "array",
								"fieldNumber": 1
							}
						}
					}
				},
				"arrayBools": {
					"object": {
						"list": [
							true,
							true,
							false,
							true,
							false,
							false
						]
					},
					"schema": {
						"type": "object",
						"properties": {
							"list": {
								"dataType": "array",
								"fieldNumber": 1
							}
						}
					}
				},
				"arrayOfObjects": {
					"object": {
						"myArray": [
							{
								"address": "e11a11364738225813f86ea85214400e5db08d6e",
								"amount": 100000
							},
							{
								"address": "aa2a11364738225813f86ea85214400e5db08fff",
								"amount": 300000
							}
						]
					},
					"schema": {
						"schema": {
							"type": "object",
							"properties": {
								"list": {
									"dataType": "array",
									"fieldNumber": 1,
									"items": {
										"type": "object",
										"properties": {
											"address": {
												"dataType": "string",
												"fieldNumber": 1
											},
											"amount": {
												"dataType": "uint64",
												"fieldNumber": 2
											}
										}
									}
								}
							}
						}
					}
				},
				"emptyArray": {
					"object": {
						"list": []
					},
					"schema": {
						"type": "object",
						"properties": {
							"list": {
								"dataType": "array",
								"fieldNumber": 1
							}
						}
					}
				}
			},
			"output": {
				"arrayIntsEncoded": "0a09030104010509020605",
				"arrayBoolsEncoded": "0a06010100010000",
				"arrayOfObjectsEncoded": "0a2e0a286531316131313336343733383232353831336638366561383532313434303065356462303864366510a08d060a2e0a286161326131313336343733383232353831336638366561383532313434303065356462303866666610e0a712",
				"emptyArrayEncoded": ""
			}
		}
	]
}
