{
	"title": "Encoding for transaction types supported by lisk-codec",
	"summary": "Examples of encoding transaction with lisk-codec",
	"config": {
		"network": "devnet"
	},
	"runner": "lisk_codec",
	"handler": "transaction_encodings",
	"testCases": [
		{
			"description": "Encoding of valid base transaction",
			"input": {
				"object": {
					"moduleID": 20,
					"assetID": 1,
					"nonce": "1570179673932370",
					"fee": "3156364651",
					"senderPublicKey": "8f057d088a585d938c20d63e430a068d4cea384e588aa0b758c68fca21644dbc",
					"asset": "f214d75bbc4b2ea89e433f3a45af803725416ec3",
					"signatures": [
						"204514eb1152355799ece36d17037e5feb4871472c60763bdafe67eb6a38bec632a8e2e62f84a32cf764342a4708a65fbad194e37feec03940f0ff84d3df2a05",
						"0b6730e5898ca56fe0dc1c73de9363f6fc8b335592ef10725a8463bff101a4943e60311f0b1a439a2c9e02cca1379b80a822f4ec48cf212bff1f1c757e92ec02"
					]
				},
				"schema": {
					"$id": "baseTransactionSchema",
					"type": "object",
					"properties": {
						"moduleID": {
							"dataType": "uint32",
							"fieldNumber": 1
						},
						"assetID": {
							"dataType": "uint32",
							"fieldNumber": 2
						},
						"nonce": {
							"dataType": "uint64",
							"fieldNumber": 3
						},
						"fee": {
							"dataType": "uint64",
							"fieldNumber": 4
						},
						"senderPublicKey": {
							"dataType": "bytes",
							"fieldNumber": 5
						},
						"asset": {
							"dataType": "bytes",
							"fieldNumber": 6
						},
						"signatures": {
							"type": "array",
							"items": {
								"dataType": "bytes"
							},
							"fieldNumber": 7
						}
					},
					"required": [
						"moduleID",
						"assetID",
						"nonce",
						"fee",
						"senderPublicKey",
						"asset",
						"signatures"
					]
				}
			},
			"output": {
				"value": "0814100118d284cb8d9f82e50220eb9a89e10b2a208f057d088a585d938c20d63e430a068d4cea384e588aa0b758c68fca21644dbc3214f214d75bbc4b2ea89e433f3a45af803725416ec33a40204514eb1152355799ece36d17037e5feb4871472c60763bdafe67eb6a38bec632a8e2e62f84a32cf764342a4708a65fbad194e37feec03940f0ff84d3df2a053a400b6730e5898ca56fe0dc1c73de9363f6fc8b335592ef10725a8463bff101a4943e60311f0b1a439a2c9e02cca1379b80a822f4ec48cf212bff1f1c757e92ec02"
			}
		},
		{
			"description": "Encoding of valid stake asset",
			"input": {
				"object": {
					"stakes": [
						{
							"validatorAddress": "cd32c73e9851c7137980063b8af64aa5a31651f8",
							"amount": "-12000000000"
						},
						{
							"validatorAddress": "9d86ad24a3f030e5522b6598115bb4d70c1692c9",
							"amount": "456000000000"
						}
					]
				},
				"schema": {
					"$id": "voteAssetSchema",
					"type": "object",
					"properties": {
						"stakes": {
							"type": "array",
							"fieldNumber": 1,
							"items": {
								"type": "object",
								"properties": {
									"validatorAddress": {
										"dataType": "bytes",
										"fieldNumber": 1
									},
									"amount": {
										"dataType": "sint64",
										"fieldNumber": 2
									}
								},
								"required": ["validatorAddress", "amount"]
							}
						}
					},
					"required": ["stakes"]
				}
			},
			"output": {
				"value": "0a1c0a14cd32c73e9851c7137980063b8af64aa5a31651f810ffdf8bb4590a1d0a149d86ad24a3f030e5522b6598115bb4d70c1692c91080c0bebbc51a"
			}
		},
		{
			"description": "Encoding of valid multisignature asset",
			"input": {
				"object": {
					"numberOfSignatures": 2,
					"mandatoryKeys": [
						"07d6389be6e2109613699c02e78253148989515c3867e4f490eafd004a95b2b4",
						"3e754d00815b6b248a981520afbaf913153a26d25e2d5283964779c65ceee7e8"
					],
					"optionalKeys": [
						"c8b8fbe474a2b63ccb9744a409569b0a465ee1803f80435aec1c5e7fc2d4ee18",
						"6115424fec0ce9c3bac5a81b5c782827d1f956fb95f1ccfa36c566d04e4d7267"
					]
				},
				"schema": {
					"$id": "multisigAssetSchema",
					"type": "object",
					"properties": {
						"numberOfSignatures": {
							"dataType": "uint32",
							"fieldNumber": 1
						},
						"mandatoryKeys": {
							"type": "array",
							"items": {
								"dataType": "bytes"
							},
							"fieldNumber": 2
						},
						"optionalKeys": {
							"type": "array",
							"items": {
								"dataType": "bytes"
							},
							"fieldNumber": 3
						}
					},
					"required": ["numberOfSignatures", "mandatoryKeys", "optionalKeys"]
				}
			},
			"output": {
				"value": "0802122007d6389be6e2109613699c02e78253148989515c3867e4f490eafd004a95b2b412203e754d00815b6b248a981520afbaf913153a26d25e2d5283964779c65ceee7e81a20c8b8fbe474a2b63ccb9744a409569b0a465ee1803f80435aec1c5e7fc2d4ee181a206115424fec0ce9c3bac5a81b5c782827d1f956fb95f1ccfa36c566d04e4d7267"
			}
		},
		{
			"description": "Encoding of valid multisignature asset with empty array",
			"input": {
				"object": {
					"numberOfSignatures": 2,
					"mandatoryKeys": [
						"c8b8fbe474a2b63ccb9744a409569b0a465ee1803f80435aec1c5e7fc2d4ee18",
						"6115424fec0ce9c3bac5a81b5c782827d1f956fb95f1ccfa36c566d04e4d7267"
					],
					"optionalKeys": []
				},
				"schema": {
					"$id": "multisigAssetSchema",
					"type": "object",
					"properties": {
						"numberOfSignatures": {
							"dataType": "uint32",
							"fieldNumber": 1
						},
						"mandatoryKeys": {
							"type": "array",
							"items": {
								"dataType": "bytes"
							},
							"fieldNumber": 2
						},
						"optionalKeys": {
							"type": "array",
							"items": {
								"dataType": "bytes"
							},
							"fieldNumber": 3
						}
					},
					"required": ["numberOfSignatures", "mandatoryKeys", "optionalKeys"]
				}
			},
			"output": {
				"value": "08021220c8b8fbe474a2b63ccb9744a409569b0a465ee1803f80435aec1c5e7fc2d4ee1812206115424fec0ce9c3bac5a81b5c782827d1f956fb95f1ccfa36c566d04e4d7267"
			}
		}
	]
}
