{
	"title": "Valid transfer transaction with multi signature",
	"summary": "A valid transfer transaction with multi signature",
	"config": {
		"network": "devnet"
	},
	"runner": "transaction_network_id_and_change_order",
	"handler": "transfer_transaction_with_multi_signature_validate",
	"testCases": [
		{
			"description": "A valid transfer transaction with multi signature",
			"input": {
				"account": {
					"passphrase": "wear protect skill sentence lift enter wild sting lottery power floor neglect",
					"privateKey": "8f41ff1e75c4f0f8a71bae4952266928d0e91660fc513566ac694fed61157497efaf1d977897cb60d7db9d30e8fd668dee070ac0db1fb8d184c06152a8b75f8d",
					"publicKey": "efaf1d977897cb60d7db9d30e8fd668dee070ac0db1fb8d184c06152a8b75f8d",
					"address": "2129300327344985743L"
				},
				"coSigners": [
					{
						"passphrase": "better across runway mansion jar route valid crack panic favorite smooth sword",
						"privateKey": "de1520f8589408e76a97643ba7d27f20009b06899816c8af20f9b03f4a4bd8a66766ce280eb99e45d2cc7d9c8c852720940dab5d69f480e80477a97b4255d5d8",
						"publicKey": "6766ce280eb99e45d2cc7d9c8c852720940dab5d69f480e80477a97b4255d5d8",
						"address": "13191770412077040757L"
					},
					{
						"passphrase": "mirror swap middle hunt angle furnace maid scheme amazing box bachelor debris",
						"privateKey": "ad7462eb8f682b0c3424213ead044381ba0007bb65ce26287fc308027c871d951387d8ec6306807ffd6fe27ea3443985765c1157928bb09904307956f46a9972",
						"publicKey": "1387d8ec6306807ffd6fe27ea3443985765c1157928bb09904307956f46a9972",
						"address": "2443122499609067441L"
					}
				],
				"networkIdentifier": "e48feb88db5b5cf5ad71d93cdcd1d879b6d5ed187a36b0002cc34e0ef9883255",
				"transaction": {
					"type": 8,
					"senderPublicKey": "efaf1d977897cb60d7db9d30e8fd668dee070ac0db1fb8d184c06152a8b75f8d",
					"timestamp": 54316325,
					"asset": {
						"recipientId": "18141291412139607230L",
						"amount": "1234567890",
						"data": "random data"
					}
				}
			},
			"output": {
				"type": 8,
				"senderPublicKey": "efaf1d977897cb60d7db9d30e8fd668dee070ac0db1fb8d184c06152a8b75f8d",
				"timestamp": 54316325,
				"asset": {
					"recipientId": "18141291412139607230L",
					"amount": "1234567890",
					"data": "random data"
				},
				"signature": "b88d0408318d3bf700586116046c9101535ee76d2d4b6a5903ac31f5d302094ad4b08180105ff91882482d5d62ca48ba2ed281b75134b90110e1a98aed7efe0d",
				"signatures": [
					"4424342c342093f80f52f919876fc0abada5385e98e8caf211add16d1c0f5453ef6e47fa58a454128a9640f3b6e2ade618e5ee5fa8eebc4d68460d19f042050f",
					"014cae10ddd5f482f8b99f8eb5699721fa795be0806118555282a304ea6a84510b1e3ec8675347c2a70f6c5abc29dc17160b94cc3cedec9f88eb1acf027ced02"
				],
				"id": "3436168030012755419"
			}
		}
	]
}
