{
	"title": "Encoding for genesis block types supported by lisk-codec",
	"summary": "Examples of encoding block with lisk-codec",
	"config": {
		"network": "devnet"
	},
	"runner": "lisk_codec",
	"handler": "genesis_block_encodings",
	"testCases": [
		{
			"description": "Encoding of valid genesis block asset",
			"input": {
				"object": {
					"initValidators": [
						"03f6d90b7dbd0497dc3a52d1c27e23bb8c75897f",
						"0903f4c5cb599a7928aef27e314e98291d1e3888",
						"0ada6a2f6c8f891769366fc9aa6fd9f1facb36cf"
					],
					"initRounds": 3,
					"accounts": [
						{
							"address": "03f6d90b7dbd0497dc3a52d1c27e23bb8c75897f",
							"publicKey": "fc65777c1d4c00f1af5880c23ba7f60cd3bf84d1bf5c697abc4ffe17cf7acac0",
							"balance": "0",
							"nonce": "0",
							"keys": {
								"mandatoryKeys": [],
								"optionalKeys": [],
								"numberOfSignatures": 0
							},
							"asset": {
								"validator": {
									"username": "genesis_34",
									"pomHeights": [],
									"consecutiveMissedBlocks": 0,
									"lastForgedHeight": 0,
									"isBanned": false,
									"totalStakeReceived": "1000000000000"
								},
								"sentStakes": [
									{
										"validatorAddress": "03f6d90b7dbd0497dc3a52d1c27e23bb8c75897f",
										"amount": "1000000000000"
									}
								],
								"unlocking": []
							}
						},
						{
							"address": "0903f4c5cb599a7928aef27e314e98291d1e3888",
							"publicKey": "3f571324e9dc7b2481b71a7dc56637f1234504158986a242e90c33d8d20fdd92",
							"balance": "0",
							"nonce": "0",
							"keys": {
								"mandatoryKeys": [],
								"optionalKeys": [],
								"numberOfSignatures": 0
							},
							"asset": {
								"validator": {
									"username": "genesis_74",
									"pomHeights": [],
									"consecutiveMissedBlocks": 0,
									"lastForgedHeight": 0,
									"isBanned": false,
									"totalStakeReceived": "1000000000000"
								},
								"sentStakes": [],
								"unlocking": []
							}
						},
						{
							"address": "0ada6a2f6c8f891769366fc9aa6fd9f1facb36cf",
							"publicKey": "c69698ef30012964aafacfbe637bb63854b6109cc5c5f22aa4b3dc3e8dca8217",
							"balance": "0",
							"nonce": "0",
							"keys": {
								"mandatoryKeys": [],
								"optionalKeys": [],
								"numberOfSignatures": 0
							},
							"asset": {
								"validator": {
									"username": "genesis_98",
									"pomHeights": [],
									"consecutiveMissedBlocks": 0,
									"lastForgedHeight": 0,
									"isBanned": false,
									"totalStakeReceived": "1000000000000"
								},
								"sentStakes": [
									{
										"validatorAddress": "0ada6a2f6c8f891769366fc9aa6fd9f1facb36cf",
										"amount": "1000000000000"
									}
								],
								"unlocking": []
							}
						}
					]
				},
				"schema": {
					"$id": "/genesisBlockAssetSchema",
					"type": "object",
					"required": ["accounts", "initValidators", "initRounds"],
					"properties": {
						"accounts": {
							"type": "array",
							"items": {
								"type": "object",
								"properties": {
									"address": {
										"dataType": "bytes",
										"fieldNumber": 1
									},
									"balance": {
										"dataType": "uint64",
										"fieldNumber": 2
									},
									"publicKey": {
										"dataType": "bytes",
										"fieldNumber": 3
									},
									"nonce": {
										"dataType": "uint64",
										"fieldNumber": 4
									},
									"keys": {
										"fieldNumber": 5,
										"type": "object",
										"properties": {
											"numberOfSignatures": {
												"dataType": "uint32",
												"fieldNumber": 1
											},
											"mandatoryKeys": {
												"type": "array",
												"items": {
													"dataType": "bytes"
												},
												"fieldNumber": 2
											},
											"optionalKeys": {
												"type": "array",
												"items": {
													"dataType": "bytes"
												},
												"fieldNumber": 3
											}
										},
										"required": ["numberOfSignatures", "mandatoryKeys", "optionalKeys"]
									},
									"asset": {
										"fieldNumber": 6,
										"type": "object",
										"properties": {
											"validator": {
												"type": "object",
												"fieldNumber": 1,
												"properties": {
													"username": {
														"dataType": "string",
														"fieldNumber": 1
													},
													"pomHeights": {
														"type": "array",
														"items": {
															"dataType": "uint32"
														},
														"fieldNumber": 2
													},
													"consecutiveMissedBlocks": {
														"dataType": "uint32",
														"fieldNumber": 3
													},
													"lastForgedHeight": {
														"dataType": "uint32",
														"fieldNumber": 4
													},
													"isBanned": {
														"dataType": "boolean",
														"fieldNumber": 5
													},
													"totalStakeReceived": {
														"dataType": "uint64",
														"fieldNumber": 6
													}
												},
												"required": [
													"username",
													"pomHeights",
													"consecutiveMissedBlocks",
													"lastForgedHeight",
													"isBanned",
													"totalStakeReceived"
												]
											},
											"sentStakes": {
												"type": "array",
												"fieldNumber": 2,
												"items": {
													"type": "object",
													"properties": {
														"validatorAddress": {
															"dataType": "bytes",
															"fieldNumber": 1
														},
														"amount": {
															"dataType": "uint64",
															"fieldNumber": 2
														}
													},
													"required": ["validatorAddress", "amount"]
												}
											},
											"unlocking": {
												"type": "array",
												"fieldNumber": 3,
												"items": {
													"type": "object",
													"properties": {
														"validatorAddress": {
															"dataType": "bytes",
															"fieldNumber": 1
														},
														"amount": {
															"dataType": "uint64",
															"fieldNumber": 2
														},
														"unstakeHeight": {
															"dataType": "uint32",
															"fieldNumber": 3
														}
													},
													"required": ["validatorAddress", "amount", "unstakeHeight"]
												}
											}
										}
									}
								},
								"required": ["address", "balance", "publicKey", "nonce", "keys", "asset"]
							},
							"fieldNumber": 1
						},
						"initValidators": {
							"type": "array",
							"items": {
								"dataType": "bytes"
							},
							"fieldNumber": 2
						},
						"initRounds": {
							"dataType": "uint32",
							"fieldNumber": 3,
							"minimum": 3
						}
					}
				}
			},
			"output": {
				"value": "0a7c0a1403f6d90b7dbd0497dc3a52d1c27e23bb8c75897f10001a20fc65777c1d4c00f1af5880c23ba7f60cd3bf84d1bf5c697abc4ffe17cf7acac020002a020800323a0a190a0a67656e657369735f33341800200028003080a094a58d1d121d0a1403f6d90b7dbd0497dc3a52d1c27e23bb8c75897f1080a094a58d1d0a5d0a140903f4c5cb599a7928aef27e314e98291d1e388810001a203f571324e9dc7b2481b71a7dc56637f1234504158986a242e90c33d8d20fdd9220002a020800321b0a190a0a67656e657369735f37341800200028003080a094a58d1d0a7c0a140ada6a2f6c8f891769366fc9aa6fd9f1facb36cf10001a20c69698ef30012964aafacfbe637bb63854b6109cc5c5f22aa4b3dc3e8dca821720002a020800323a0a190a0a67656e657369735f39381800200028003080a094a58d1d121d0a140ada6a2f6c8f891769366fc9aa6fd9f1facb36cf1080a094a58d1d121403f6d90b7dbd0497dc3a52d1c27e23bb8c75897f12140903f4c5cb599a7928aef27e314e98291d1e388812140ada6a2f6c8f891769366fc9aa6fd9f1facb36cf1803"
			}
		}
	]
}
