{
	"title": "Decoding for block header types supported by lisk-codec",
	"summary": "Examples of encoding block header with lisk-codec",
	"config": {
		"network": "devnet"
	},
	"runner": "lisk_codec",
	"handler": "block_header_decodings",
	"testCases": [
		{
			"description": "Decoding of valid block header 1",
			"input": {
				"value": "08011085f6b7f60518c3faf3052220ba7816bf8f01cfea414140de5dae2223b00361a396177a9cb410ff61f20015ad2a20a665a45920422f9d417e4867efdc4fb8a04a1f3fff1fa07e998e86f7f7a27ae3322068a751863fe73b8ede8d832be628ff680d617fa15c74d00142f9025d5f37dd50388088debe014220d59386e0ae435e292fbe0ebcdb954b75ed5fb3922091277cb19f798fc5d507184a408331b5123cac056e2ec8361c56e642db0ca0e13abe33696d23d4d00ad6de844919296e87abe8e172f67fd882b4c0b1c1804b7d9075ecf975cf2631d8d7efef0c",
				"schema": {
					"$id": "/blockHeaderSchema",
					"type": "object",
					"properties": {
						"version": {
							"dataType": "uint32",
							"fieldNumber": 1
						},
						"timestamp": {
							"dataType": "uint32",
							"fieldNumber": 2
						},
						"height": {
							"dataType": "uint32",
							"fieldNumber": 3
						},
						"previousBlockID": {
							"dataType": "bytes",
							"fieldNumber": 4
						},
						"transactionRoot": {
							"dataType": "bytes",
							"fieldNumber": 5
						},
						"generatorPublicKey": {
							"dataType": "bytes",
							"fieldNumber": 6
						},
						"reward": {
							"dataType": "uint64",
							"fieldNumber": 7
						},
						"asset": {
							"dataType": "bytes",
							"fieldNumber": 8
						},
						"signature": {
							"dataType": "bytes",
							"fieldNumber": 9
						}
					},
					"required": [
						"version",
						"timestamp",
						"height",
						"previousBlockID",
						"transactionRoot",
						"generatorPublicKey",
						"reward",
						"asset"
					]
				}
			},
			"output": {
				"object": {
					"version": 1,
					"timestamp": 1590557445,
					"height": 12385603,
					"previousBlockID": "ba7816bf8f01cfea414140de5dae2223b00361a396177a9cb410ff61f20015ad",
					"transactionRoot": "a665a45920422f9d417e4867efdc4fb8a04a1f3fff1fa07e998e86f7f7a27ae3",
					"generatorPublicKey": "68a751863fe73b8ede8d832be628ff680d617fa15c74d00142f9025d5f37dd50",
					"reward": "400000000",
					"asset": "d59386e0ae435e292fbe0ebcdb954b75ed5fb3922091277cb19f798fc5d50718",
					"signature": "8331b5123cac056e2ec8361c56e642db0ca0e13abe33696d23d4d00ad6de844919296e87abe8e172f67fd882b4c0b1c1804b7d9075ecf975cf2631d8d7efef0c"
				}
			}
		},
		{
			"description": "Decoding of valid block header 2",
			"input": {
				"value": "080310ecf8b7f60518b9ff362220e3b0c44298fc1c149afbf4c8996fb92427ae41e4649b934ca495991b7852b8552a20e3b0c44298fc1c149afbf4c8996fb92427ae41e4649b934ca495991b7852b8553220acc56344dea609e80cf5d4165e46917104fe701927847fc2a5d40e37574b2b38388088debe014220eaaf9d4c65cb501c811ef812847a55513181474d734ead1b95b7e1e5b574d2234a401e65032943af975c3cdef94b1fce639645bddb29265321e0277a0f48143ef7f6f6daa1046234a09cc593969ff04d8d082edd15a4a9b90a7b8865fcd9dac44300",
				"schema": {
					"$id": "/blockHeaderSchema",
					"type": "object",
					"properties": {
						"version": {
							"dataType": "uint32",
							"fieldNumber": 1
						},
						"timestamp": {
							"dataType": "uint32",
							"fieldNumber": 2
						},
						"height": {
							"dataType": "uint32",
							"fieldNumber": 3
						},
						"previousBlockID": {
							"dataType": "bytes",
							"fieldNumber": 4
						},
						"transactionRoot": {
							"dataType": "bytes",
							"fieldNumber": 5
						},
						"generatorPublicKey": {
							"dataType": "bytes",
							"fieldNumber": 6
						},
						"reward": {
							"dataType": "uint64",
							"fieldNumber": 7
						},
						"asset": {
							"dataType": "bytes",
							"fieldNumber": 8
						},
						"signature": {
							"dataType": "bytes",
							"fieldNumber": 9
						}
					},
					"required": [
						"version",
						"timestamp",
						"height",
						"previousBlockID",
						"transactionRoot",
						"generatorPublicKey",
						"reward",
						"asset"
					]
				}
			},
			"output": {
				"object": {
					"version": 3,
					"timestamp": 1590557804,
					"height": 901049,
					"previousBlockID": "e3b0c44298fc1c149afbf4c8996fb92427ae41e4649b934ca495991b7852b855",
					"transactionRoot": "e3b0c44298fc1c149afbf4c8996fb92427ae41e4649b934ca495991b7852b855",
					"generatorPublicKey": "acc56344dea609e80cf5d4165e46917104fe701927847fc2a5d40e37574b2b38",
					"reward": "400000000",
					"asset": "eaaf9d4c65cb501c811ef812847a55513181474d734ead1b95b7e1e5b574d223",
					"signature": "1e65032943af975c3cdef94b1fce639645bddb29265321e0277a0f48143ef7f6f6daa1046234a09cc593969ff04d8d082edd15a4a9b90a7b8865fcd9dac44300"
				}
			}
		}
	]
}
