{
	"title": "Valid block processing",
	"summary": "A valid block with a transfer transaction is processed",
	"config": {
		"network": "mainnet"
	},
	"runner": "block_processing_transfers",
	"handler": "valid_block_processing_one_transfer_tx",
	"testCases": [
		{
			"config": {
				"initialState": {
					"chain": [
						{
							"version": 1,
							"totalAmount": "5000000000",
							"totalFee": "10000000",
							"reward": "0",
							"timestamp": 10,
							"numberOfTransactions": 1,
							"payloadLength": 117,
							"previousBlock": "6524861224470851795",
							"generatorPublicKey": "addb0e15a44b0fdc6ff291be28d8c98f5551d0cd9218d749e30ddb87c6e31ca9",
							"transactions": [
								{
									"id": "13770683072257473810",
									"amount": "5000000000",
									"type": 0,
									"timestamp": 102702700,
									"senderPublicKey": "c094ebee7ec0c50ebee32918655e089f6e1a604b83bcaa760293c61e0f18ab6f",
									"senderId": "16313739661670634666L",
									"recipientId": "10881167371402274308L",
									"fee": "10000000",
									"signature": "464abe544bea2f536475c9f8408fba6084df10c4700019a99c3ded11953df78396891f32b92b4e8454d5fbe2758cf971f9bce594e40f5b0cdd78b5e70e876e0d",
									"signatures": [],
									"asset": {}
								}
							],
							"payloadHash": "123d64444b4b1bbfba75b499238cee9341f82e87047df78a2b414629a03e0e63",
							"blockSignature": "298092da8fd4cf4c9d03a9c717bcb81274bbf34e0e6e7039cce162ca266551160d4566e509143c2f109c3bf7fd43edf4551565039e3ed73e474e511ac23ddc04",
							"height": 2
						}
					],
					"accounts": [
						{
							"address": "16313739661670634666L",
							"publicKey": "c094ebee7ec0c50ebee32918655e089f6e1a604b83bcaa760293c61e0f18ab6f",
							"secondPublicKey": null,
							"username": null,
							"isDelegate": false,
							"secondSignature": false,
							"balance": 9999899990000000,
							"multiMin": 0,
							"multiLifetime": 0,
							"nameExist": false,
							"missedBlocks": 0,
							"producedBlocks": 0,
							"rank": null,
							"fees": 0,
							"rewards": 0,
							"vote": 0,
							"productivity": 0
						},
						{
							"address": "10881167371402274308L",
							"publicKey": "addb0e15a44b0fdc6ff291be28d8c98f5551d0cd9218d749e30ddb87c6e31ca9",
							"secondPublicKey": null,
							"username": "genesis_100",
							"isDelegate": true,
							"secondSignature": false,
							"balance": 0,
							"multiMin": 0,
							"multiLifetime": 0,
							"nameExist": false,
							"missedBlocks": 1,
							"producedBlocks": 0,
							"rank": 70,
							"fees": 0,
							"rewards": 0,
							"vote": 9999899990000000,
							"productivity": 0
						}
					]
				}
			},
			"description": "A valid block with a transfer transaction is processed",
			"input": {
				"version": 1,
				"totalAmount": "4000000000",
				"totalFee": "10000000",
				"reward": "0",
				"timestamp": 20,
				"numberOfTransactions": 1,
				"payloadLength": 117,
				"generatorPublicKey": "addb0e15a44b0fdc6ff291be28d8c98f5551d0cd9218d749e30ddb87c6e31ca9",
				"transactions": [
					{
						"id": "13571226364241390960",
						"amount": "4000000000",
						"type": 0,
						"timestamp": 102702700,
						"senderPublicKey": "addb0e15a44b0fdc6ff291be28d8c98f5551d0cd9218d749e30ddb87c6e31ca9",
						"senderId": "10881167371402274308L",
						"recipientId": "2222471382442610527L",
						"fee": "10000000",
						"signature": "ed6ca09502e49dfd87959392faec9600dc0bba96a80e927f4219f7c6954766e0c35ae0209528107388c47b63608c9c2846f8b896c4645fba2dc6c14c13a2cc0c",
						"signatures": [],
						"asset": {}
					}
				],
				"payloadHash": "702d068f79ae56bc591c5e01b090df97ee71a593bdfb78a7e203d8c582d18e3f",
				"blockSignature": "189c7e0b4fbc73c19700a8b23e080110d280b1d2f2f1926abb98183a57939c3b292c672e169370dbbe98c4297c83a12f90c10775624626fb065d25e0b6c83f00",
				"height": 3
			},
			"output": {
				"chain": [
					{
						"version": 1,
						"totalAmount": "5000000000",
						"totalFee": "10000000",
						"reward": "0",
						"timestamp": 10,
						"numberOfTransactions": 1,
						"payloadLength": 117,
						"previousBlock": "6524861224470851795",
						"generatorPublicKey": "addb0e15a44b0fdc6ff291be28d8c98f5551d0cd9218d749e30ddb87c6e31ca9",
						"transactions": [
							{
								"id": "13770683072257473810",
								"amount": "5000000000",
								"type": 0,
								"timestamp": 102702700,
								"senderPublicKey": "c094ebee7ec0c50ebee32918655e089f6e1a604b83bcaa760293c61e0f18ab6f",
								"senderId": "16313739661670634666L",
								"recipientId": "10881167371402274308L",
								"fee": "10000000",
								"signature": "464abe544bea2f536475c9f8408fba6084df10c4700019a99c3ded11953df78396891f32b92b4e8454d5fbe2758cf971f9bce594e40f5b0cdd78b5e70e876e0d",
								"signatures": [],
								"asset": {}
							}
						],
						"payloadHash": "123d64444b4b1bbfba75b499238cee9341f82e87047df78a2b414629a03e0e63",
						"blockSignature": "298092da8fd4cf4c9d03a9c717bcb81274bbf34e0e6e7039cce162ca266551160d4566e509143c2f109c3bf7fd43edf4551565039e3ed73e474e511ac23ddc04",
						"height": 2
					},
					{
						"version": 1,
						"totalAmount": "4000000000",
						"totalFee": "10000000",
						"reward": "0",
						"timestamp": 20,
						"numberOfTransactions": 1,
						"payloadLength": 117,
						"generatorPublicKey": "addb0e15a44b0fdc6ff291be28d8c98f5551d0cd9218d749e30ddb87c6e31ca9",
						"transactions": [
							{
								"id": "13571226364241390960",
								"amount": "4000000000",
								"type": 0,
								"timestamp": 102702700,
								"senderPublicKey": "addb0e15a44b0fdc6ff291be28d8c98f5551d0cd9218d749e30ddb87c6e31ca9",
								"senderId": "10881167371402274308L",
								"recipientId": "2222471382442610527L",
								"fee": "10000000",
								"signature": "ed6ca09502e49dfd87959392faec9600dc0bba96a80e927f4219f7c6954766e0c35ae0209528107388c47b63608c9c2846f8b896c4645fba2dc6c14c13a2cc0c",
								"signatures": [],
								"asset": {}
							}
						],
						"payloadHash": "702d068f79ae56bc591c5e01b090df97ee71a593bdfb78a7e203d8c582d18e3f",
						"blockSignature": "189c7e0b4fbc73c19700a8b23e080110d280b1d2f2f1926abb98183a57939c3b292c672e169370dbbe98c4297c83a12f90c10775624626fb065d25e0b6c83f00",
						"height": 3
					}
				],
				"accounts": [
					[
						{
							"address": "16313739661670634666L",
							"publicKey": "c094ebee7ec0c50ebee32918655e089f6e1a604b83bcaa760293c61e0f18ab6f",
							"secondPublicKey": null,
							"username": null,
							"isDelegate": false,
							"secondSignature": false,
							"balance": "9999894980000000",
							"multiMin": 0,
							"multiLifetime": 0,
							"nameExist": false,
							"missedBlocks": 0,
							"producedBlocks": 0,
							"rank": null,
							"fees": 0,
							"rewards": 0,
							"vote": 0,
							"productivity": 0
						},
						{
							"address": "10881167371402274308L",
							"publicKey": "addb0e15a44b0fdc6ff291be28d8c98f5551d0cd9218d749e30ddb87c6e31ca9",
							"secondPublicKey": null,
							"username": "genesis_100",
							"isDelegate": true,
							"secondSignature": false,
							"balance": "990000000",
							"multiMin": 0,
							"multiLifetime": 0,
							"nameExist": false,
							"missedBlocks": 1,
							"producedBlocks": 0,
							"rank": 70,
							"fees": 0,
							"rewards": 0,
							"vote": 9999899990000000,
							"productivity": 0
						},
						{
							"address": "2222471382442610527L",
							"publicKey": "caff2242b740a733daa3f3f96fc1592303b60c1704a8ac626e2704da039f41ee",
							"secondPublicKey": null,
							"username": "",
							"isDelegate": false,
							"secondSignature": false,
							"balance": "4000000000",
							"multiMin": 0,
							"multiLifetime": 0,
							"nameExist": false,
							"missedBlocks": 0,
							"producedBlocks": 0,
							"rank": 0,
							"fees": 0,
							"rewards": 0,
							"vote": 0,
							"productivity": 0
						}
					]
				]
			}
		}
	]
}
