{
	"title": "Valid delegate transaction",
	"summary": "A valid delegate transaction",
	"config": {
		"network": "devnet"
	},
	"runner": "transaction_network_id_and_change_order",
	"handler": "delegate_transaction_validate",
	"testCases": [
		{
			"description": "A valid delegate transaction",
			"input": {
				"account": {
					"passphrase": "wear protect skill sentence lift enter wild sting lottery power floor neglect",
					"privateKey": "8f41ff1e75c4f0f8a71bae4952266928d0e91660fc513566ac694fed61157497efaf1d977897cb60d7db9d30e8fd668dee070ac0db1fb8d184c06152a8b75f8d",
					"publicKey": "efaf1d977897cb60d7db9d30e8fd668dee070ac0db1fb8d184c06152a8b75f8d",
					"address": "2129300327344985743L"
				},
				"networkIdentifier": "e48feb88db5b5cf5ad71d93cdcd1d879b6d5ed187a36b0002cc34e0ef9883255",
				"transaction": {
					"type": 10,
					"senderPublicKey": "efaf1d977897cb60d7db9d30e8fd668dee070ac0db1fb8d184c06152a8b75f8d",
					"timestamp": 54316335,
					"asset": {
						"username": "new_delegate"
					}
				}
			},
			"output": {
				"type": 10,
				"senderPublicKey": "efaf1d977897cb60d7db9d30e8fd668dee070ac0db1fb8d184c06152a8b75f8d",
				"timestamp": 54316335,
				"asset": {
					"username": "new_delegate"
				},
				"signature": "50041721c3317058bf454f15de169e666f4f363b22532e204336fd620918f9ef4698411407d96ce9242fb3a5107f2113bb1b48234c63f1f836fc6b7c37b7d002",
				"id": "5726885376730735876"
			}
		}
	]
}
