{
	"title": "Encondings for a peer info object",
	"summary": "Example of encoding a peer info object for p2p",
	"config": {
		"network": "devnet"
	},
	"runner": "lisk_codec",
	"handler": "peer_info_sample_encoding",
	"testCases": [
		{
			"description": "Encoding of peer info sample",
			"input": {
				"object": {
					"ipAddress": "1.1.1.1",
					"wsPort": 1111,
					"networkIdentifier": "f8fe7ecc3e29f58f39d8a538f9a35b80b4b6ab9674f0300e25e33ff41274ae32",
					"networkVersion": "2.0",
					"nonce": "iNIgD0Mb3s/RMaXbs",
					"os": "darwin",
					"height": 123
				},
				"schema": {
					"$id": "peerInfo",
					"type": "object",
					"properties": {
						"ipAddress": {
							"dataType": "string",
							"fieldNumber": 1
						},
						"wsPort": {
							"dataType": "uint32",
							"fieldNumber": 2
						},
						"networkIdentifier": {
							"dataType": "string",
							"fieldNumber": 3
						},
						"networkVersion": {
							"dataType": "string",
							"fieldNumber": 4
						},
						"nonce": {
							"dataType": "string",
							"fieldNumber": 5
						},
						"os": {
							"dataType": "string",
							"fieldNumber": 6
						},
						"height": {
							"dataType": "uint32",
							"fieldNumber": 7
						}
					},
					"required": ["ipAddress", "wsPort"]
				}
			},
			"output": {
				"value": "0a07312e312e312e3110d7081a40663866653765636333653239663538663339643861353338663961333562383062346236616239363734663033303065323565333366663431323734616533322203322e302a11694e496744304d6233732f524d61586273320664617277696e387b"
			}
		},
		{
			"description": "Encoding of peer info sample with optional property",
			"input": {
				"object": {
					"ipAddress": "1.1.1.1",
					"wsPort": 1111,
					"os": "darwin"
				},
				"schema": {
					"$id": "peerInfo",
					"type": "object",
					"properties": {
						"ipAddress": {
							"dataType": "string",
							"fieldNumber": 1
						},
						"wsPort": {
							"dataType": "uint32",
							"fieldNumber": 2
						},
						"networkIdentifier": {
							"dataType": "string",
							"fieldNumber": 3
						},
						"networkVersion": {
							"dataType": "string",
							"fieldNumber": 4
						},
						"nonce": {
							"dataType": "string",
							"fieldNumber": 5
						},
						"os": {
							"dataType": "string",
							"fieldNumber": 6
						},
						"height": {
							"dataType": "uint32",
							"fieldNumber": 7
						}
					},
					"required": ["ipAddress", "wsPort"]
				}
			},
			"output": {
				"value": "0a07312e312e312e3110d708320664617277696e"
			}
		}
	]
}
