{
	"title": "Decoding for block types supported by lisk-codec",
	"summary": "Examples of encoding block with lisk-codec",
	"config": {
		"network": "devnet"
	},
	"runner": "lisk_codec",
	"handler": "block_decodings",
	"testCases": [
		{
			"description": "Decoding of valid block with payload",
			"input": {
				"value": "0a20ba7816bf8f01cfea414140de5dae2223b00361a396177a9cb410ff61f20015ad1220a665a45920422f9d417e4867efdc4fb8a04a1f3fff1fa07e998e86f7f7a27ae3122068a751863fe73b8ede8d832be628ff680d617fa15c74d00142f9025d5f37dd50",
				"schema": {
					"$id": "/blockSchema",
					"type": "object",
					"properties": {
						"header": {
							"dataType": "bytes",
							"fieldNumber": 1
						},
						"payload": {
							"type": "array",
							"items": {
								"dataType": "bytes"
							},
							"fieldNumber": 2
						}
					},
					"required": ["header", "payload"]
				}
			},
			"output": {
				"object": {
					"header": "ba7816bf8f01cfea414140de5dae2223b00361a396177a9cb410ff61f20015ad",
					"payload": [
						"a665a45920422f9d417e4867efdc4fb8a04a1f3fff1fa07e998e86f7f7a27ae3",
						"68a751863fe73b8ede8d832be628ff680d617fa15c74d00142f9025d5f37dd50"
					]
				}
			}
		},
		{
			"description": "Decoding of valid block block without payload",
			"input": {
				"value": "0a20e3b0c44298fc1c149afbf4c8996fb92427ae41e4649b934ca495991b7852b855",
				"schema": {
					"$id": "/blockSchema",
					"type": "object",
					"properties": {
						"header": {
							"dataType": "bytes",
							"fieldNumber": 1
						},
						"payload": {
							"type": "array",
							"items": {
								"dataType": "bytes"
							},
							"fieldNumber": 2
						}
					},
					"required": ["header", "payload"]
				}
			},
			"output": {
				"object": {
					"header": "e3b0c44298fc1c149afbf4c8996fb92427ae41e4649b934ca495991b7852b855",
					"payload": []
				}
			}
		}
	]
}
