{
	"title": "Encondings for block types supported by lisk-codec",
	"summary": "Examples of encoding block with lisk-codec",
	"config": {
		"network": "devnet"
	},
	"runner": "lisk_codec",
	"handler": "block_encodings",
	"testCases": [
		{
			"description": "Encoding of valid block with payload",
			"input": {
				"object": {
					"header": {
						"type": "Buffer",
						"data": [
							186,
							120,
							22,
							191,
							143,
							1,
							207,
							234,
							65,
							65,
							64,
							222,
							93,
							174,
							34,
							35,
							176,
							3,
							97,
							163,
							150,
							23,
							122,
							156,
							180,
							16,
							255,
							97,
							242,
							0,
							21,
							173
						]
					},
					"payload": [
						{
							"type": "Buffer",
							"data": [
								166,
								101,
								164,
								89,
								32,
								66,
								47,
								157,
								65,
								126,
								72,
								103,
								239,
								220,
								79,
								184,
								160,
								74,
								31,
								63,
								255,
								31,
								160,
								126,
								153,
								142,
								134,
								247,
								247,
								162,
								122,
								227
							]
						},
						{
							"type": "Buffer",
							"data": [
								104,
								167,
								81,
								134,
								63,
								231,
								59,
								142,
								222,
								141,
								131,
								43,
								230,
								40,
								255,
								104,
								13,
								97,
								127,
								161,
								92,
								116,
								208,
								1,
								66,
								249,
								2,
								93,
								95,
								55,
								221,
								80
							]
						}
					]
				},
				"schema": {
					"$id": "blockSchema",
					"type": "object",
					"properties": {
						"header": {
							"dataType": "bytes",
							"fieldNumber": 1
						},
						"payload": {
							"type": "array",
							"items": {
								"dataType": "bytes"
							},
							"fieldNumber": 2
						}
					},
					"required": [
						"header",
						"payload"
					]
				}
			},
			"output": {
				"value": "0a20ba7816bf8f01cfea414140de5dae2223b00361a396177a9cb410ff61f20015ad1220a665a45920422f9d417e4867efdc4fb8a04a1f3fff1fa07e998e86f7f7a27ae3122068a751863fe73b8ede8d832be628ff680d617fa15c74d00142f9025d5f37dd50"
			}
		},
		{
			"description": "Encoding of valid block block without payload",
			"input": {
				"object": {
					"header": {
						"type": "Buffer",
						"data": [
							227,
							176,
							196,
							66,
							152,
							252,
							28,
							20,
							154,
							251,
							244,
							200,
							153,
							111,
							185,
							36,
							39,
							174,
							65,
							228,
							100,
							155,
							147,
							76,
							164,
							149,
							153,
							27,
							120,
							82,
							184,
							85
						]
					},
					"payload": []
				},
				"schema": {
					"$id": "blockSchema",
					"type": "object",
					"properties": {
						"header": {
							"dataType": "bytes",
							"fieldNumber": 1
						},
						"payload": {
							"type": "array",
							"items": {
								"dataType": "bytes"
							},
							"fieldNumber": 2
						}
					},
					"required": [
						"header",
						"payload"
					]
				}
			},
			"output": {
				"value": "0a20e3b0c44298fc1c149afbf4c8996fb92427ae41e4649b934ca495991b7852b855"
			}
		}
	]
}
